{
  "event_id": "5d6e7f83-c057-4c30-be18-76b15e80c434",
  "event_type": "checkout_started",
  "event_version": 1,
  "occurred_at": "2026-08-24T09:03:00Z",
  "source": "nextjs",
  "sales_channel_id": "018f1a2b3c4d5e6f7890abcdef123456",
  "market_code": "de",
  "domain": "www.jvmoebel.de",
  "visitor_id": "550e8400-e29b-41d4-a716-446655440000",
  "session_id": "9b1de427-512a-482e-a2bf-66d1f6de06e3",
  "cart_id": "161ac41f-6684-4757-b9ec-47e107f7b04e",
  "correlation_id": "8fbf6d3c-7d55-49d2-8442-7be5fcad934e",
  "payload": {
    "line_items": [
      {
        "sku": "SOFA-001",
        "name": "Sofa Milano",
        "quantity": 1,
        "unit_price": "2499.00",
        "total_price": "2499.00"
      }
    ],
    "total_amount": "2499.00",
    "currency": "EUR"
  }
}
