{
  "event_id": "7f8091a5-e279-4e52-9a3a-98d370a2e656",
  "event_type": "payment_method_selected",
  "event_version": 1,
  "occurred_at": "2026-08-24T09:05:00Z",
  "source": "nextjs",
  "sales_channel_id": "018f1a2b3c4d5e6f7890abcdef123456",
  "market_code": "de",
  "visitor_id": "550e8400-e29b-41d4-a716-446655440000",
  "session_id": "9b1de427-512a-482e-a2bf-66d1f6de06e3",
  "cart_id": "161ac41f-6684-4757-b9ec-47e107f7b04e",
  "correlation_id": "8fbf6d3c-7d55-49d2-8442-7be5fcad934e",
  "payload": {
    "payment_method": "paypal"
  }
}
