{
  "event_id": "3a4b5c61-ae35-4a1e-9cc5-53f93c6fa212",
  "event_type": "product_viewed",
  "event_version": 1,
  "occurred_at": "2026-08-24T09:01:00Z",
  "source": "nextjs",
  "sales_channel_id": "018f1a2b3c4d5e6f7890abcdef123456",
  "market_code": "de",
  "domain": "www.jvmoebel.de",
  "language": "de-DE",
  "visitor_id": "550e8400-e29b-41d4-a716-446655440000",
  "session_id": "9b1de427-512a-482e-a2bf-66d1f6de06e3",
  "payload": {
    "sku": "SOFA-001",
    "name": "Sofa Milano",
    "category": "sofas",
    "unit_price": "2499.00",
    "currency": "EUR"
  }
}
